{
  "schema": "bjorn-vectors/assessor-input/v0",
  "status": "DESIGN CANDIDATE / PROPOSED, NOT EXECUTED",
  "case_id": "B2-f",
  "family": "B2",
  "claim": {"kind": "no_bypass", "polarity": "every effect on a required surface in the scope took a mediated route", "scope": {"surfaces": ["gw-http", "alt-db"], "interval": {"start": "2026-01-01T02:00:00Z", "end": "2026-01-01T03:00:00Z"}}, "cutoff": "2026-01-01T03:05:00Z"},
  "integrity_inputs": {"provenance": "synthetic stage-1 declaration for design review; no signature or chain verification was performed", "chain": "verified", "records": 3, "visible_log": "consistent: seq 0-2 contiguous, no repeated record_id"},
  "records": [
    {"record_id": "R-a120", "seq": 0, "time": "2026-01-01T02:10:00Z", "surface": "gw-http", "effect_ref": "X-11"},
    {"record_id": "R-a121", "seq": 1, "time": "2026-01-01T02:50:00Z", "surface": "alt-db", "effect_ref": "X-12"},
    {"record_id": "R-a122", "seq": 2, "time": "2026-01-01T02:55:00Z", "surface": "gw-http", "effect_ref": "X-13"}
  ],
  "assumptions": [
    {"id": "A4", "text": "db-audit-feed is produced by the database independently of the agent gateway and emits one entry, with its own feed_seq, for every committed write", "status": "declared_not_verified"},
    {"id": "A5", "text": "within an available segment, a feed_seq range from first_seq to last_seq with heartbeats and no declared gaps means no committed write in that segment went unreported", "status": "declared_not_verified"},
    {"id": "A7", "text": "rp-http-ledger records every request executed at the gw-http endpoint, one numbered entry per execution", "status": "declared_not_verified"}
  ],
  "observations": [
    {"surface": "gw-http", "evidence_id": "OB-http", "observer": "rp-http-ledger", "mechanism": "relying-party execution ledger, one numbered entry per executed request; no execution route is exported", "segments": [{"start": "2026-01-01T02:00:00Z", "end": "2026-01-01T03:00:00Z", "status": "available", "completeness": {"kind": "sequenced_ledger", "first_seq": 40, "last_seq": 41, "gaps": []}}], "observed_effects": [{"effect_id": "E-11", "time": "2026-01-01T02:10:00Z", "effect_ref": "X-11", "feed_seq": 40}, {"effect_id": "E-13", "time": "2026-01-01T02:55:00Z", "effect_ref": "X-13", "feed_seq": 41}], "assumptions": ["A7"]},
    {"surface": "alt-db", "evidence_id": "OB-db", "observer": "db-audit-feed", "mechanism": "database audit feed: one entry per committed write, 60-second heartbeats, sequenced feed_seq; no execution route is exported", "segments": [{"start": "2026-01-01T02:00:00Z", "end": "2026-01-01T03:00:00Z", "status": "available", "completeness": {"kind": "sequenced_feed", "first_seq": 500, "last_seq": 560, "heartbeat_interval_s": 60, "gaps": []}}], "observed_effects": [{"effect_id": "E-12", "time": "2026-01-01T02:50:00Z", "effect_ref": "X-12", "feed_seq": 552}], "assumptions": ["A4", "A5"]}
  ],
  "mediation_evidence": []
}
