{
  "schema": "bjorn-vectors/assessor-input/v0",
  "status": "DESIGN CANDIDATE / PROPOSED, NOT EXECUTED",
  "case_id": "B1-a1",
  "family": "B1",
  "claim": {"kind": "coverage_complete", "polarity": "every evidence obligation of src-1 due in the interval is met by exactly one record", "scope": {"instance_id": "src-1", "interval": {"start": "2026-01-01T00:00:00Z", "end": "2026-01-01T01:00:00Z"}}, "cutoff": "2026-01-01T01:05:00Z"},
  "source_instances": [{"instance_id": "src-1", "epochs": [{"epoch_id": "src-1/e1", "counter_start": 0, "declared_start": "2026-01-01T00:00:00Z"}, {"epoch_id": "src-1/e2", "counter_start": 0, "declared_start": "2026-01-01T00:25:00Z", "start_reason": "restart_counter_reset"}]}],
  "integrity_inputs": {"provenance": "synthetic stage-1 declaration for design review; no signature or chain verification was performed", "per_epoch": [{"epoch_id": "src-1/e1", "chain": "verified", "records": 3}, {"epoch_id": "src-1/e2", "chain": "verified", "records": 3}]},
  "records": [
    {"record_id": "R-91d2", "epoch_id": "src-1/e1", "seq": 0, "time": "2026-01-01T00:05:00Z", "obligation_id": "O-3a7e"},
    {"record_id": "R-4c08", "epoch_id": "src-1/e1", "seq": 1, "time": "2026-01-01T00:10:00Z", "obligation_id": "O-b519"},
    {"record_id": "R-e6f3", "epoch_id": "src-1/e1", "seq": 2, "time": "2026-01-01T00:15:00Z", "obligation_id": "O-2d84"},
    {"record_id": "R-07ab", "epoch_id": "src-1/e2", "seq": 0, "time": "2026-01-01T00:30:00Z", "obligation_id": "O-58c1"},
    {"record_id": "R-d3e9", "epoch_id": "src-1/e2", "seq": 1, "time": "2026-01-01T00:40:00Z", "obligation_id": "O-f60b"},
    {"record_id": "R-6b15", "epoch_id": "src-1/e2", "seq": 2, "time": "2026-01-01T00:50:00Z", "obligation_id": "O-9e27"}
  ],
  "assumptions": [],
  "population_evidence": {"kind": "none"}
}
